{"schema_version":"4.0.0","artifact":{"file":"RBX_ANIME_DOLL_AVATAR_SETUP_SAFE_REPAIR_V2.glb","sha256":"b551a526e6d613132fb6b5dd2ae3a6c0cf4ff44a980a31c00906fcadc976a142","source_file":"RBX_ANIME_DOLL_AVATAR_SETUP_NEGZ_BAKED.glb","source_sha256":"b3b5bcb4fa0f1cb7574bd242e24ea9e6b9fae9289c192a6d77dc979ebc2317e7","pipeline":"avatar_setup_body_input_candidate","path":"artifact/RBX_ANIME_DOLL_AVATAR_SETUP_SAFE_REPAIR_V2.glb","source_path":"source/RBX_ANIME_DOLL_AVATAR_SETUP_NEGZ_BAKED.glb"},"coverage_model":{"name":"power_of_two_spatial_visual_pyramid","canonical_views":62,"essential_passes_62":4,"extended_passes_12":8,"scale_factors":[1,2,4,8],"grid_levels":[1,2,4,8],"cells_per_image":85,"actual_rendered_view_passes":344,"silhouette_multiscale_evaluations":248,"appearance_multiscale_evaluations":48,"silhouette_spatial_cells":5270,"appearance_spatial_cells":1020,"semantic_visibility_cells":240,"total_quantitative_observations":7170},"structure":{"local_parser_errors":[],"geometry_nodes":20,"triangles":9864,"triangle_limit":10742,"triangle_margin":878,"dimensions_stud":[3.3498592376708984,6.5,1.0927150249481201],"node_transforms_identity":true},"geometry":{"physical_boundary_edges":0,"physical_nonmanifold_edges":0,"degenerate_triangles":0,"duplicate_face_groups":0,"render_boundary_edges":2610},"surface":{"normals_finite":true,"normal_length_min":0.9999999403953552,"normal_length_max":1.0,"uv_outside_0_1_count":0,"uv_exact":{"textured_uv_triangles":9740,"nonzero_overlap_pairs":0,"exact_overlap_area":0.0,"exact_overlap_ratio":0.0,"status":"PASS","tolerance_area":1e-12},"texture_byte_exact":true,"texture_sha256":"193701f1f7d3c85f16da09d0ce8b26b8c0c85ed6771d694eabd62be73faa35a6"},"visual":{"silhouette_iou_min_all_cells":0.9137931034482759,"silhouette_iou_p05_all_cells":1.0,"appearance_ssim_min_all_cells":0.8899377699721357,"appearance_ssim_p05_all_cells":0.9889209367496222,"ms_ssim_min":0.9983350797549064,"ms_ssim_mean":0.9988634496992916,"deltaE00_p95_max":1.3355753421783447,"semantic_visible_view_count":{"Tongue_Component":7,"LowerTeeth_Component":0,"UpperTeeth_Component":5,"MouthBag_Component":7,"RightEye_Component":7,"LeftEye_Component":7,"RightFoot_Geo_Input":11,"RightLowerLeg_Geo_Input":11,"RightUpperLeg_Geo_Input":11,"LeftFoot_Geo_Input":11,"LeftLowerLeg_Geo_Input":11,"LeftUpperLeg_Geo_Input":11,"RightHand_Geo_Input":11,"RightArm_Unpartitioned_Input":11,"LeftHand_Geo_Input":11,"LeftArm_Unpartitioned_Input":11,"LowerTorso_Geo_Input":12,"UpperTorso_Geo_Input":12,"Neck_ResolutionMatched_Input":12,"Head_Geo_Input":12},"expected_external_semantic_visible":true,"internal_components_present":{"MouthBag_Component":true,"UpperTeeth_Component":true,"LowerTeeth_Component":true,"Tongue_Component":true},"expected_semantic_contract_satisfied":true},"project_policy":{"authority":"internal_project_policy_not_official_roblox","frozen":true,"thresholds":{"ms_ssim_min":0.95,"appearance_cell_p05_min":0.9,"physical_boundary_edges_max":0,"physical_nonmanifold_edges_max":0,"exact_uv_overlap_pairs_max":0}},"external_gates":{"khronos_gltf_validator":"NOT_RUN","blender_4_5_12_import_reopen_exact_artifact":"NOT_RUN","roblox_avatar_setup":"NOT_RUN","roblox_studio_playtest":"NOT_RUN","ugc_validation":"NOT_RUN"},"decision":{"status":"LOCAL_EXPONENTIAL_REVIEWED","release_eligible":false,"manual_override":false,"reason_codes":["EXTERNAL_KHRONOS_NOT_RUN","LOCKED_BLENDER_REOPEN_NOT_RUN","ROBLOX_AVATAR_SETUP_NOT_RUN","ROBLOX_STUDIO_NOT_RUN","UGC_VALIDATION_NOT_RUN"]},"evidence":[{"path":"renders/PASS_ALBEDO_12.png","sha256":"7af5551431fc51a34ef19e817e898706c28bc580fa80c03619777084533eff88","size_bytes":130329,"artifact_sha256":"b551a526e6d613132fb6b5dd2ae3a6c0cf4ff44a980a31c00906fcadc976a142"},{"path":"renders/PASS_BEAUTY_12.png","sha256":"27451398a4e9187effdccef70a2675ce1e4a8634670cdf99f371c7b68a062415","size_bytes":143258,"artifact_sha256":"b551a526e6d613132fb6b5dd2ae3a6c0cf4ff44a980a31c00906fcadc976a142"},{"path":"renders/PASS_BEAUTY_62.png","sha256":"f40b198ef42f5a4212d31ac16c54531d7ddf76cc42730da41439266714ac99c1","size_bytes":296001,"artifact_sha256":"b551a526e6d613132fb6b5dd2ae3a6c0cf4ff44a980a31c00906fcadc976a142"},{"path":"renders/PASS_CHECKER_12.png","sha256":"c029f9103b7c8ec4d9a0e824e03325776e103fc5d30935060266530f652e1666","size_bytes":29916,"artifact_sha256":"b551a526e6d613132fb6b5dd2ae3a6c0cf4ff44a980a31c00906fcadc976a142"},{"path":"renders/PASS_DEPTH_12.png","sha256":"81176b6affea3be7708e06a2ba31cb933099d2ba8df70d2866dac70e3b32e27d","size_bytes":58642,"artifact_sha256":"b551a526e6d613132fb6b5dd2ae3a6c0cf4ff44a980a31c00906fcadc976a142"},{"path":"renders/PASS_NORMAL_12.png","sha256":"372f6e235b106c73f89dfda3a0bdf8c7acb020b1a27acdf8a486e9b6fd963d4d","size_bytes":130073,"artifact_sha256":"b551a526e6d613132fb6b5dd2ae3a6c0cf4ff44a980a31c00906fcadc976a142"},{"path":"renders/PASS_NORMAL_62.png","sha256":"1bddacc9ac512c788b6dc400ca2c9d4f05391593067d63ed036304b24e017608","size_bytes":297926,"artifact_sha256":"b551a526e6d613132fb6b5dd2ae3a6c0cf4ff44a980a31c00906fcadc976a142"},{"path":"renders/PASS_SEMANTIC_12.png","sha256":"973eae8ee39ba6958aa8b31f135d3c902fe9082e6cc152d694de7daf24670401","size_bytes":18875,"artifact_sha256":"b551a526e6d613132fb6b5dd2ae3a6c0cf4ff44a980a31c00906fcadc976a142"},{"path":"renders/PASS_SEMANTIC_62.png","sha256":"797259b8a41937e7b96aa92d25d95ef6fb095a16fcdaba4b79375b7a9f7bab66","size_bytes":66574,"artifact_sha256":"b551a526e6d613132fb6b5dd2ae3a6c0cf4ff44a980a31c00906fcadc976a142"},{"path":"renders/PASS_SILHOUETTE_12.png","sha256":"3a51628cb34c307f411cd1a01ac4483e5185a562aac6e1da6835b4cc7800ab91","size_bytes":15130,"artifact_sha256":"b551a526e6d613132fb6b5dd2ae3a6c0cf4ff44a980a31c00906fcadc976a142"},{"path":"renders/PASS_SILHOUETTE_62.png","sha256":"75bc23e926cf82fec54c77e29136473da850787fda9c1fc7434ad12856518ef9","size_bytes":47159,"artifact_sha256":"b551a526e6d613132fb6b5dd2ae3a6c0cf4ff44a980a31c00906fcadc976a142"},{"path":"renders/PASS_WIREFRAME_12.png","sha256":"af9ba1f8fda129b9f26eaa9950182cc93ed3e6cfc5c2511cbf9a51e2c9332ece","size_bytes":25679,"artifact_sha256":"b551a526e6d613132fb6b5dd2ae3a6c0cf4ff44a980a31c00906fcadc976a142"},{"path":"renders/PROOF_EXPONENTIAL_DASHBOARD.png","sha256":"f9ed6a5fa5d1ebda738d0328ed2c4da32080496dddac017ae76a1ddbb9df8e20","size_bytes":103023,"artifact_sha256":"b551a526e6d613132fb6b5dd2ae3a6c0cf4ff44a980a31c00906fcadc976a142"},{"path":"renders/PROOF_HEAD_INTERNALS_ISOLATED.png","sha256":"5ee91add039a663a96332b77de84308ddd12d83f2e56b3739fe4445f1a4527fb","size_bytes":19125,"artifact_sha256":"b551a526e6d613132fb6b5dd2ae3a6c0cf4ff44a980a31c00906fcadc976a142"},{"path":"renders/PROOF_RESOLUTION_LADDER.png","sha256":"02b481ba070d0e5d1b7ed833dd1d2ae44164cc6a4b7326d4828763b9ea81100d","size_bytes":259453,"artifact_sha256":"b551a526e6d613132fb6b5dd2ae3a6c0cf4ff44a980a31c00906fcadc976a142"},{"path":"renders/PROOF_SEMANTIC_REGION_ZOOMS.png","sha256":"1ad268539885ead8af86e70f366d78c9c8ad0270cafb5d5f8d6acb90c19ce9c5","size_bytes":750745,"artifact_sha256":"b551a526e6d613132fb6b5dd2ae3a6c0cf4ff44a980a31c00906fcadc976a142"},{"path":"renders/PROOF_SEMANTIC_VISIBILITY_MATRIX.png","sha256":"aa18bd74e6cb89597acdc632606a33b66a79915ad29557ef33494bf9633b1e72","size_bytes":129192,"artifact_sha256":"b551a526e6d613132fb6b5dd2ae3a6c0cf4ff44a980a31c00906fcadc976a142"},{"path":"renders/PROOF_WORST_PYRAMID_CELLS.png","sha256":"41ceccf79a83ac42a1397a69b5305326295322f1d668e44f5d0c7cd0e09676db","size_bytes":412173,"artifact_sha256":"b551a526e6d613132fb6b5dd2ae3a6c0cf4ff44a980a31c00906fcadc976a142"}]}